{"$id":"https://codextradingengine.local/schemas/gate1_closure_threat_model_v0_1.schema.json","$schema":"https://json-schema.org/draft/2020-12/schema","title":"CodexTradingEngine Gate 1 Closure Threat Model v0.1","type":"object","additionalProperties":false,"properties":{"artifact_type":{"const":"Gate1ClosureThreatModel"},"contract_version":{"const":"codex-gate1-closure-v0.1"},"receipt_sha256":{"type":"string","pattern":"^[0-9a-f]{64}$"},"generated_at":{"type":"string","format":"date-time"},"scope":{"type":"object","additionalProperties":false,"properties":{"active_lane":{"const":"TESTNET_READ_ONLY_ALPHA"},"network":{"type":"string","minLength":1},"source_id":{"type":"string","minLength":1},"source_review_expires_at":{"type":"string","format":"date-time"},"mainnet_allowed":{"const":false},"proposal_generation_allowed":{"const":false},"execution_allowed":{"const":false}},"required":["active_lane","network","source_id","source_review_expires_at","mainnet_allowed","proposal_generation_allowed","execution_allowed"]},"assets":{"type":"array","minItems":1,"items":{"type":"object","additionalProperties":false,"properties":{"asset":{"type":"string","minLength":1},"protection_goal":{"type":"string","minLength":1}},"required":["asset","protection_goal"]}},"trust_boundaries":{"type":"array","minItems":1,"items":{"type":"object","additionalProperties":false,"properties":{"boundary":{"type":"string","minLength":1},"rule":{"type":"string","minLength":1}},"required":["boundary","rule"]}},"transport_posture":{"type":"object","additionalProperties":false,"properties":{"allowed_methods":{"type":"array","items":{"enum":["GET","HEAD"]},"minItems":1,"uniqueItems":true},"exact_host_allowlist":{"type":"array","items":{"type":"string","minLength":1},"minItems":1,"uniqueItems":true},"port":{"const":443},"tls_hostname_verification":{"const":true},"public_ip_enforcement":{"const":true},"preflight_and_postflight_dns_check":{"const":true},"connection_ip_pinning":{"const":true},"timeout_seconds":{"type":"integer","minimum":1,"maximum":30},"response_cap_bytes":{"type":"integer","minimum":1,"maximum":1048576},"freshness_ttl_seconds":{"type":"integer","minimum":1,"maximum":3600},"automatic_recurrence":{"const":false}},"required":["allowed_methods","exact_host_allowlist","port","tls_hostname_verification","public_ip_enforcement","preflight_and_postflight_dns_check","connection_ip_pinning","timeout_seconds","response_cap_bytes","freshness_ttl_seconds","automatic_recurrence"]},"threats":{"type":"array","minItems":13,"items":{"type":"object","additionalProperties":false,"properties":{"threat_id":{"type":"string","pattern":"^T[0-9]{2}_[A-Z0-9_]+$"},"class":{"type":"string","minLength":1},"scenario":{"type":"string","minLength":1},"mitigation":{"type":"string","minLength":1},"disposition":{"enum":["MITIGATED","ACCEPTED_RESIDUAL","HOLD_IF_DETECTED"]}},"required":["threat_id","class","scenario","mitigation","disposition"]}},"evidence_lineage":{"type":"array","minItems":1,"items":{"type":"object","additionalProperties":false,"properties":{"evidence_id":{"type":"string","minLength":1},"class":{"type":"string","minLength":1},"uri":{"type":"string","minLength":1},"sha256":{"type":"string","pattern":"^[0-9a-f]{64}$"},"hash_basis":{"enum":["canonical_artifact_id","recorded_campaign_receipt","sha256_of_canonical_lineage_record","sha256_of_canonical_review_identity","sha256_of_canonical_merge_lineage"]},"notes":{"type":"string","minLength":1}},"required":["evidence_id","class","uri","sha256","hash_basis","notes"]}},"merge_lineage":{"type":"array","minItems":1,"items":{"type":"object","additionalProperties":false,"properties":{"id":{"type":"string","minLength":1},"commit":{"type":"string","pattern":"^[0-9a-f]{40}$"},"path":{"type":"string","minLength":1}},"required":["id","commit","path"]}},"rollback":{"type":"object","additionalProperties":false,"properties":{"tested":{"const":true},"target_gate":{"const":"SIMULATION_ONLY"},"plan_sha256":{"type":"string","pattern":"^[0-9a-f]{64}$"},"test_receipt_sha256":{"type":"string","pattern":"^[0-9a-f]{64}$"},"triggers":{"type":"array","minItems":4,"uniqueItems":true,"items":{"enum":["kill_switch","source_outage","dns_policy_failure","operator_abort"]}}},"required":["tested","target_gate","plan_sha256","test_receipt_sha256","triggers"]},"residual_risks":{"type":"array","minItems":1,"items":{"type":"object","additionalProperties":false,"properties":{"risk_id":{"type":"string","pattern":"^R[0-9]{2}_[A-Z0-9_]+$"},"status":{"enum":["ACCEPTED_FOR_GATE1A_ONLY","BLOCKS_GATE1B"]},"description":{"type":"string","minLength":1},"treatment":{"type":"string","minLength":1}},"required":["risk_id","status","description","treatment"]}},"unresolved_questions":{"type":"array","items":{"type":"string","minLength":1},"minItems":1},"counts":{"type":"object","additionalProperties":false,"properties":{"live_proposals_generated":{"const":0},"signatures_created":{"const":0},"transactions_submitted":{"const":0},"executions_performed":{"const":0},"charity_transfers":{"const":0},"capital_movements":{"const":0}},"required":["live_proposals_generated","signatures_created","transactions_submitted","executions_performed","charity_transfers","capital_movements"]},"gate_posture":{"type":"object","additionalProperties":false,"properties":{"gate_0":{"const":"ACTIVE"},"gate_1a":{"const":"ACTIVE_FOR_APPROVED_ALPHA_RUNS"},"gate_1b":{"const":"LOCKED"},"gate_2":{"const":"LOCKED"},"gate_3":{"const":"LOCKED"},"gate_4_through_6":{"const":"LOCKED"}},"required":["gate_0","gate_1a","gate_1b","gate_2","gate_3","gate_4_through_6"]},"authority":{"type":"object","additionalProperties":false,"properties":{"artifact_is_command":{"const":false},"authority":{"const":false},"human_promotion_required":{"const":true},"may_generate_live_proposal":{"const":false},"may_sign":{"const":false},"may_submit_transaction":{"const":false},"may_execute":{"const":false},"may_use_flash_liquidity":{"const":false},"may_transfer_charity":{"const":false},"may_move_capital":{"const":false}},"required":["artifact_is_command","authority","human_promotion_required","may_generate_live_proposal","may_sign","may_submit_transaction","may_execute","may_use_flash_liquidity","may_transfer_charity","may_move_capital"]}},"required":["artifact_type","contract_version","receipt_sha256","generated_at","scope","assets","trust_boundaries","transport_posture","threats","evidence_lineage","merge_lineage","rollback","residual_risks","unresolved_questions","counts","gate_posture","authority"]}
