{"artifact_type":"Gate1ClosureThreatModel","assets":[{"asset":"gate_integrity","protection_goal":"No observation or evidence artifact may inherit proposal or execution authority."},{"asset":"source_provenance","protection_goal":"Every admitted observation remains traceable to source, review, timestamp, unit, and content hash."},{"asset":"replay_corpus","protection_goal":"Accepted captures remain immutable and deterministically replayable."},{"asset":"operator_consent","protection_goal":"Gate promotion remains a separate explicit human act."}],"authority":{"artifact_is_command":false,"authority":false,"human_promotion_required":true,"may_execute":false,"may_generate_live_proposal":false,"may_move_capital":false,"may_sign":false,"may_submit_transaction":false,"may_transfer_charity":false,"may_use_flash_liquidity":false},"contract_version":"codex-gate1-closure-v0.1","counts":{"capital_movements":0,"charity_transfers":0,"executions_performed":0,"live_proposals_generated":0,"signatures_created":0,"transactions_submitted":0},"evidence_lineage":[{"class":"baseline_soak","evidence_id":"baseline_soak","hash_basis":"sha256_of_canonical_lineage_record","notes":"100-cycle deterministic simulation baseline; the hash anchors repository path, run ID, and producer commit.","sha256":"aa8d222c65158e6077ca05b7ebad33df0778acb56f5ea2e70fb4dd50d0cccb6b","uri":"repo://docs/testing/results/EVE_Q_SOAK_RESULT_20260711T202544Z.json"},{"class":"source_review","evidence_id":"source_review","hash_basis":"sha256_of_canonical_review_identity","notes":"Time-bounded Sepolia Blockscout review, expiring 2026-09-04T01:12:00Z.","sha256":"bb2e349ae0db0b20fb30fea3bcdcef625b9f525823793c81c9c9c1b05d92c18c","uri":"repo://docs/source-reviews/ETHEREUM_SEPOLIA_BLOCKSCOUT_STATS_v0_1.md"},{"class":"live_read_only_soak","evidence_id":"live_soak_summary","hash_basis":"recorded_campaign_receipt","notes":"25 requested, attempted, accepted, and replayed; zero rollbacks and zero authority transitions.","sha256":"2f95d2b027ab72c06670645a1204a86517c6657d5edac22fe8c008018a389393","uri":"artifact://gate1a/sepolia-soak/summary"},{"class":"live_read_only_soak","evidence_id":"live_soak_record_ledger","hash_basis":"recorded_campaign_receipt","notes":"Content address of the bounded capture record ledger.","sha256":"c5b1215ee3f0a623e840f7a21425a5b483c84657b05377720851e0d966d36653","uri":"artifact://gate1a/sepolia-soak/record-ledger"},{"class":"live_read_only_soak","evidence_id":"live_soak_replay_ledger","hash_basis":"recorded_campaign_receipt","notes":"Content address of the full replay ledger.","sha256":"f27a858152b0a43adee504e7ff67a26ef3a9bd0c7840fe966dca94c167834d85","uri":"artifact://gate1a/sepolia-soak/replay-ledger"},{"class":"rollback_test","evidence_id":"rollback_test","hash_basis":"canonical_artifact_id","notes":"Canonical operator-abort receipt proving restoration to Gate 0 while Gates 2-6 remain locked.","sha256":"7c33eefc8f6d2331553853dfe8e57c346d87cf64369008ee8c98c0f34c936ba9","uri":"repo://examples/governance/gate1_closure_rollback_receipt_v0_1.json"},{"class":"epistemic_diversity","evidence_id":"source_consensus","hash_basis":"sha256_of_canonical_lineage_record","notes":"Offline conflict, concentration, stale, unit, and review-expiry refusal matrix merged at 1dda4089fd6f6c8eadc0550f65abaa2d7511303a.","sha256":"318edd37964505a52eaa7e56c6d049dbbe434ac362e00d513ccd226b4a6f59a0","uri":"repo://docs/alpha/GATE1_SOURCE_CONSENSUS_EVIDENCE_v0_1.md"},{"class":"contract_lineage","evidence_id":"merge_lineage","hash_basis":"sha256_of_canonical_merge_lineage","notes":"Ordered merge lineage from hardening through source-consensus evidence.","sha256":"ec67290832164d2f600570a4fdeafe5f718bf797e89f7bfa75dea2ee7a545f20","uri":"repo://docs/governance/EVE_Q_GATE1_CLOSURE_THREAT_MODEL_v0_1.md#lineage"}],"gate_posture":{"gate_0":"ACTIVE","gate_1a":"ACTIVE_FOR_APPROVED_ALPHA_RUNS","gate_1b":"LOCKED","gate_2":"LOCKED","gate_3":"LOCKED","gate_4_through_6":"LOCKED"},"generated_at":"2026-08-05T04:20:00Z","merge_lineage":[{"commit":"6b6eaef8f888e72a63aa612bceb940e1ef44b185","id":"gate1_hardening","path":"eve_q/gate1_hardening.py"},{"commit":"73513c698910b6f28bb7cf17e26c8d07b39d803b","id":"gate1a_promotion","path":"docs/governance/EVE_Q_GATE1A_ALPHA_PROMOTION_v0_1.md"},{"commit":"bc394223270c4ccd29d62a6d68cfb74ea356e11c","id":"alpha_doctor","path":"eve_q/alpha_doctor.py"},{"commit":"e1542ac0f22a5f91af3faadf70320ba41a1901bf","id":"telemetry_draft","path":"eve_q/telemetry_draft_fixture.py"},{"commit":"6e1a4e547267db90f9f512bfe2927f38f2962f04","id":"alpha_operator","path":"eve_q/alpha_operator.py"},{"commit":"a1fcb7fae8f866dcb53cc573b73f912952e408b4","id":"first_live_rehearsal","path":"docs/source-reviews/ETHEREUM_SEPOLIA_BLOCKSCOUT_STATS_v0_1.md"},{"commit":"bfc7b86cf1c9079450c9bcad45774506cc5371e8","id":"fixed_count_soak","path":"docs/alpha/SEPOLIA_GATE1_SOAK_CAMPAIGN_v0_1.md"},{"commit":"1dda4089fd6f6c8eadc0550f65abaa2d7511303a","id":"source_consensus","path":"docs/alpha/GATE1_SOURCE_CONSENSUS_EVIDENCE_v0_1.md"}],"receipt_sha256":"fe9beccfe7d9028b5b872b9ee4ac6131832a348f3eaa68b2489dc0b5536d3f78","residual_risks":[{"description":"The live campaign used one Sepolia Blockscout instance; transport stability is proven, independent live truth is not.","risk_id":"R01_SINGLE_LIVE_PROVIDER","status":"BLOCKS_GATE1B","treatment":"Keep conclusions source-specific, use the offline consensus tribunal for future multi-source admission, and require a separately reviewed mainnet source set before Gate 1B."},{"description":"DNS, endpoint behavior, rate limits, terms, and response contracts remain controlled by an external provider.","risk_id":"R02_EXTERNAL_PROVIDER_DRIFT","status":"ACCEPTED_FOR_GATE1A_ONLY","treatment":"Time-bound source review, stop on drift, re-review by 2026-09-04T01:12:00Z, and preserve rollback."},{"description":"Provider-reported counters and gas fields are workflow observations, not executable prices or profitability proof.","risk_id":"R03_NON_EXECUTABLE_SEMANTICS","status":"ACCEPTED_FOR_GATE1A_ONLY","treatment":"Require explicit translation, assumptions, missing-economics disclosure, local simulation, and no live proposal routing."}],"rollback":{"plan_sha256":"30dfadb82a2e78379eecf676e6ae6ec588394c825649b418148f99ccec2591b8","target_gate":"SIMULATION_ONLY","test_receipt_sha256":"7c33eefc8f6d2331553853dfe8e57c346d87cf64369008ee8c98c0f34c936ba9","tested":true,"triggers":["kill_switch","source_outage","dns_policy_failure","operator_abort"]},"scope":{"active_lane":"TESTNET_READ_ONLY_ALPHA","execution_allowed":false,"mainnet_allowed":false,"network":"Ethereum Sepolia","proposal_generation_allowed":false,"source_id":"ethereum-sepolia-blockscout-stats-v0-1","source_review_expires_at":"2026-09-04T01:12:00Z"},"threats":[{"class":"source_outage","disposition":"MITIGATED","mitigation":"Fail closed, emit rollback evidence, stop the run, and preserve the last valid replay corpus.","scenario":"Reviewed endpoint is unavailable, times out, or fails during a bounded capture.","threat_id":"T01_SOURCE_OUTAGE"},{"class":"dns_ip_drift","disposition":"MITIGATED","mitigation":"Require reviewed DNS hostname, public-address enforcement, preflight and postflight comparison, and transport-level connection pinning while retaining TLS hostname verification.","scenario":"The reviewed hostname resolves to non-public or changed addresses between preflight and postflight.","threat_id":"T02_DNS_IP_DRIFT"},{"class":"redirect_host_escape","disposition":"MITIGATED","mitigation":"Reject cross-host redirects and stop the capture.","scenario":"A redirect attempts to leave the exact reviewed host.","threat_id":"T03_REDIRECT_ESCAPE"},{"class":"payload_tamper","disposition":"MITIGATED","mitigation":"Verify raw and normalized SHA-256 values, canonical artifact IDs, and replay hashes; fail closed on mismatch.","scenario":"Persisted raw, normalized, or replay artifacts are changed after capture.","threat_id":"T04_PAYLOAD_TAMPER"},{"class":"stale_evidence","disposition":"MITIGATED","mitigation":"Enforce per-observation TTL and refuse mixed fresh/stale evidence with HOLD_STALE.","scenario":"An expired observation is admitted or borrows freshness from another source.","threat_id":"T05_STALE_EVIDENCE"},{"class":"malformed_oversized_payload","disposition":"MITIGATED","mitigation":"Enforce content type, parser, response-size, and schema boundaries; reject without retrying into authority.","scenario":"The source returns malformed, unsupported, or oversized content.","threat_id":"T06_MALFORMED_OVERSIZED"},{"class":"write_secret_leakage","disposition":"MITIGATED","mitigation":"Run targeted secret-name preflight, require no wallet/signing credentials, and keep connector methods GET/HEAD only.","scenario":"Write-capable credentials are present in the environment or become reachable by the read-only lane.","threat_id":"T07_SECRET_LEAKAGE"},{"class":"authority_leakage","disposition":"MITIGATED","mitigation":"Fix authority fields and counts at false/zero, assert downstream gates locked, and reject command-shaped artifacts.","scenario":"An observation, fixture, report, or evidence artifact is interpreted as permission to propose, sign, transact, execute, or move capital.","threat_id":"T08_AUTHORITY_LEAKAGE"},{"class":"material_conflict","disposition":"MITIGATED","mitigation":"Preserve each observation and conflict magnitude; return HOLD_CONFLICT without averaging.","scenario":"Admissible sources disagree beyond a declared tolerance.","threat_id":"T09_MATERIAL_CONFLICT"},{"class":"provenance_concentration","disposition":"MITIGATED","mitigation":"Return HOLD_CONCENTRATION and keep aggregate_value null.","scenario":"Agreeing surfaces share one provider or provenance group and masquerade as independent corroboration.","threat_id":"T10_PROVENANCE_CONCENTRATION"},{"class":"unit_ambiguity","disposition":"MITIGATED","mitigation":"Allow only explicit identity or decimal-scale conversions; return HOLD_UNIT_AMBIGUITY otherwise.","scenario":"Values use